{
  "schema_version": 1,
  "article_key": "seo-ffc-theoretical-hit-rate-v1",
  "title": "分分彩技术分析：理论命中率应该怎样计算",
  "slug": "ffc-theoretical-hit-rate-calculation",
  "content": "<p>做分分彩技术分析时，理论命中率应该在看历史结果之前先确定。它来自玩法的样本空间、实际投注集合和命中定义，而不是从一段历史数据里挑出表现较好的参数后再反推。只有理论概率先固定，后面的历史验证才有清晰的比较基准。</p><h2>一、先写清楚什么算“命中”</h2><p>同一个选号规则可能有不同的命中定义。例如只要求某一位置包含在候选集合中，与要求多个位置同时满足条件，概率结构完全不同。验证前需要把位置、候选数字数量、投注玩法和命中条件写成可以逐期复算的规则。</p><h2>二、单位置候选数字可以从覆盖数量开始算</h2><p>如果某一位置的可能数字共有10个，并且规则在不重复的情况下覆盖其中4个，那么在理想均匀模型下，单位置覆盖事件的理论概率可以从4/10开始理解。但真正投注时还要继续考虑玩法组合方式，因为“覆盖事件发生”并不一定等于“获得某个具体玩法的返奖”。</p><h2>三、多位置和组合玩法不能简单把百分比相加</h2><p>当规则涉及多个位置、组选或组合条件时，需要按照具体样本空间计算。某些事件可以用乘法或组合数学处理，某些事件之间存在重叠，需要先排除重复。最安全的做法是直接枚举合法结果或使用明确的组合公式，再与软件实际生成的注数核对。</p><h2>四、理论命中率要和真实注数同时记录</h2><p>提高候选数字数量通常会提高覆盖概率，但也可能增加投注注数。技术分析不能只报告理论命中率提升了多少，还要说明为此增加了多少实际成本。否则一个“90%覆盖”的规则可能只是通过大幅扩大投注范围得到，并不代表资金效率更高。</p><h2>五、历史命中率是验证，不是替代理论概率</h2><p>理论概率固定后，可以把历史命中率作为观测值。如果200期历史命中率与理论值存在明显差异，应先检查数据完整性、规则实现、样本量和是否存在事后调参，而不是立即得出“规律改变”的结论。样本继续扩大后，这种比较才更有意义。</p><p>因此，理论命中率的作用不是预测下一期，而是给方案一个事前可计算的概率基准。再把它和真实注数、返奖、连续不中及资金暴露结合，才能形成完整的方案验证。</p>",
  "excerpt": "分分彩理论命中率应由样本空间、候选集合和命中定义事前计算，再与真实注数和历史命中率一起验证。",
  "seo_title": "分分彩技术分析：理论命中率怎么计算才正确？",
  "meta_description": "说明分分彩理论命中率的计算顺序，从命中定义、单位置覆盖、多位置组合、真实注数到历史验证，避免用历史结果反推概率。",
  "primary_keyword": "分分彩技术",
  "secondary_keywords": ["分分彩理论命中率", "分分彩概率", "分分彩注数", "分分彩数据分析", "分分彩方案验证"],
  "catid": 7,
  "thumbnail": "",
  "internal_links": [],
  "publish_at": "2026-08-13T09:00:00+08:00",
  "author": "老彩迷编辑",
  "content_type": "guide",
  "source_notes": "SEO Batch 1；概率基础与验证方法，不预测下一期。",
  "commercial_disclosure": false
}
