{
  "schema_version": 1,
  "article_key": "seo-ffc-betting-economics-v1",
  "title": "分分彩投注技巧：先算命中率、单期成本还是返奖？",
  "slug": "ffc-betting-hit-rate-cost-payout",
  "content": "<p>研究分分彩投注技巧时，最常见的顺序错误，是先盯着某套选号规则最近中了多少次，再去考虑投注成本和返奖。这样做很容易把“命中得多”误解成“资金结果更好”。更稳妥的顺序应该是先把玩法经济结构算清楚，再把命中率放进去验证。</p><h2>一、第一步先算单期真实成本</h2><p>单期成本由实际注数、单注金额和投注倍数组成。假设某个规则每期需要投注8注，单注金额为2元，1倍时单期成本就是16元。如果后续采用倍投，应该逐档记录每一期实际投入，而不是只写一个“2倍、3倍”的倍率名称。只有把真实金额列出来，才能继续计算连续不中时的累计损失。</p><h2>二、第二步确认中奖后的总返奖</h2><p>返奖和净收益不是一回事。若某一期中奖总返奖为20元，而这一期投注成本为16元，那么只看当期的净差额是4元；如果此前已经连续亏损了多期，还需要把此前累计投入一起计入。返点也应单独核算，不能把返点直接当作中奖奖金重复计算。</p><h2>三、第三步再看理论命中率</h2><p>理论命中率应该从玩法规则、候选数字数量和实际投注集合推导，而不是从一小段历史数据倒推。历史命中率可以用来检查规则表现是否与理论预期差异过大，但它不能替代理论概率，更不能证明下一期会按照过去的频率重复。</p><h2>四、最后才判断一套资金路径能否执行</h2><p>把单期成本、中奖返奖、返点和命中率放在一起后，还要继续检查最大连续不中、累计资金暴露和停止条件。例如一套倍投在前几档看起来很轻，但后段为了追平此前亏损快速放大金额，那么真正决定它能不能执行的，是尾段最大投入和总本金承受能力，而不是前几期的收益截图。</p><h2>五、一个简单的验证顺序</h2><p>实际研究时可以固定为五步：先确认玩法和注数；再算1倍单期成本；然后确认中奖总返奖与返点；接着计算理论命中率和历史命中率；最后根据总本金反推最大可承受资金暴露与停止条件。这样得到的结论更容易复算，也更容易发现规则本身的问题。</p><p>历史数据适合用来验证规则、统计回撤和寻找失败区间，但不能保证未来结果。所谓投注技巧如果没有成本、返奖、连续不中和停止条件，只展示历史命中次数，就还不是一套完整的可执行方案。</p>",
  "excerpt": "研究分分彩投注技巧时，应先核算单期成本、中奖返奖和返点，再结合理论与历史命中率判断资金路径和最大风险。",
  "seo_title": "分分彩投注技巧：命中率、单期成本和返奖应该先算哪个？",
  "meta_description": "分分彩投注技巧不能只看历史命中率。本文按单期成本、中奖返奖、返点、理论命中率、连续不中和最大资金暴露的顺序说明如何验证一套方案。",
  "primary_keyword": "分分彩投注技巧",
  "secondary_keywords": [
    "分分彩投注方法",
    "分分彩命中率",
    "分分彩单期成本",
    "分分彩返奖",
    "分分彩资金管理"
  ],
  "catid": 7,
  "thumbnail": "",
  "internal_links": [],
  "publish_at": "2026-08-11T07:15:00+08:00",
  "author": "老彩迷编辑",
  "content_type": "guide",
  "source_notes": "Native Publisher V2启用后的第一篇生产内容金丝雀；内容为计算与风险验证方法，不承诺盈利。",
  "commercial_disclosure": false
}
