{
  "schema_version": 1,
  "article_key": "seo-ffc-high-hit-not-profit-v1",
  "title": "分分彩技巧中的“高命中率”为什么不等于高收益",
  "slug": "ffc-high-hit-rate-not-profit",
  "content": "<p>在分分彩技巧讨论里，“命中率高”很容易被直接理解成“更容易赚钱”。这两个概念实际上不是同一件事。命中率描述的是某个规则在给定条件下命中事件出现的频率，而资金结果还取决于每期投注成本、命中返奖、返点、倍投路径以及连续不中时的累计损失。</p><h2>一、先把命中率从资金结果里拆出来</h2><p>假设一种规则历史上100期命中80期，这只能说明按照预先固定的命中定义，它在这段样本里的历史命中率是80%。如果每期为了覆盖更多候选数字需要投入较高成本，而单次命中的返奖只略高于当期成本，那么剩下20期的亏损仍可能使总结果为负。</p><h2>二、命中一次要覆盖多少成本才是关键</h2><p>评价资金结果时，可以把每次命中后的总返奖减去当期成本，再与此前未中产生的累计损失比较。如果命中只覆盖当期投入，却无法覆盖之前的亏损，那么增加命中次数不一定能改善整个周期的结果。使用倍投时，这一问题会更加明显，因为后段单期成本可能迅速增大。</p><h2>三、高命中玩法往往伴随更多注数</h2><p>一些规则通过扩大候选数字集合提高覆盖率，同时也增加实际注数。此时需要比较的不是“选8个数字比选4个数字更容易中”这种显然事实，而是新增注数带来的成本是否与返奖结构匹配。理论命中率和玩法经济结构必须同时计算。</p><h2>四、历史高命中还要检查样本稳定性</h2><p>如果参数是在看完历史数据后不断调整出来的，高命中率可能只是对这一段样本的拟合。更稳妥的做法是冻结规则，再用后续样本、滚动窗口或样本外区间继续验证，同时记录最长连续不中和最大回撤，而不是只保留命中次数。</p><h2>五、评价一套技巧至少看五项数据</h2><p>一套规则可以同时记录理论命中率、历史命中率、单期真实成本、单次命中净结果和最大资金暴露。若使用返点，还要把返点单独列出。这样才能判断所谓“高命中”究竟来自更有效的规则，还是仅仅来自投注范围扩大。</p><p>命中率是验证指标之一，不是盈利保证。历史数据可以用来发现风险和检查规则，但未来开奖结果仍具有不确定性。把概率指标和资金指标分开计算，通常比单独追求一个漂亮的命中率更有信息价值。</p>",
  "excerpt": "分分彩高命中率不等于高收益。需要同时核算真实注数、单期成本、返奖、连续不中、倍投路径和最大资金暴露。",
  "seo_title": "分分彩技巧：为什么高命中率不等于高收益？",
  "meta_description": "解释分分彩技巧中命中率与资金结果的区别，从注数、成本、返奖、连续不中、倍投和样本外验证说明为什么不能只看历史高命中率。",
  "primary_keyword": "分分彩技巧",
  "secondary_keywords": ["分分彩命中率", "分分彩收益", "分分彩投注成本", "分分彩倍投", "分分彩数据分析"],
  "catid": 7,
  "thumbnail": "",
  "internal_links": [],
  "publish_at": "2026-08-12T17:00:00+08:00",
  "author": "老彩迷编辑",
  "content_type": "guide",
  "source_notes": "SEO Batch 1；解释概率与资金结果区别，不承诺盈利。",
  "commercial_disclosure": false
}
