{
  "schema_version": 1,
  "article_key": "ffc-betting-basics-risk-v1",
  "title": "分分彩投注技巧：先看命中率、奖金与资金风险",
  "slug": "ffc-betting-basics-risk",
  "content": "<p>讨论分分彩投注技巧时，最容易出现的误区，是只看某一种选号方法最近中了多少次，却忽略了单期成本、中奖返奖、连续不中和资金承受能力。一个方案能不能长期执行，至少要同时把命中率、每次投注成本、中奖后的净结果以及连续不中时的累计损失放在一起计算。</p><h2>一、命中率不能单独代表盈利能力</h2><p>例如某个玩法的历史命中率看起来很高，但如果每次命中得到的返奖不足以覆盖之前的累计投注，那么高命中率也不等于高收益。相反，有些低频玩法单次返奖较高，但连续不中时的资金波动也会明显增加。因此，研究一个方案时，应先把“命中概率”和“经济结构”分开计算，再判断二者组合后的结果。</p><h2>二、倍投首先是资金路径，不是提高开奖概率</h2><p>倍投只会改变不同期次投入的金额，并不会改变下一期开奖结果本身。合理的倍投设计应该先规定最大资金暴露、允许承受的连续不中长度以及停止条件，再决定每一档投入多少。若一套倍投只有在无限本金的前提下才能成立，那么它在真实执行中就不具备可操作性。</p><h2>三、历史数据适合验证规则，不适合保证未来</h2><p>历史开奖可以用来检查一个规则是否存在明显缺陷，例如某组选法在200期里出现过多长的连续不中、某种资金路径最大回撤是多少、同一组参数是否只在某一小段数据有效。但历史表现不能直接证明未来仍会重复，因此更有价值的做法是保留样本外验证、滚动测试和失败案例。</p><h2>四、实际投注前先做三项检查</h2><p>第一，计算单期真实成本和中奖返奖；第二，设定总本金中允许暴露的最大比例；第三，提前写明停止、降级或暂停条件。只有这三项都明确，所谓“技巧”才从一个选号想法变成可以验证的投注方案。</p><p>本站后续会继续用具体历史样本、投注数字和资金路径对不同方案进行验证，同时保留连续不中、回撤和失败结果。任何方案都存在风险，不应把历史命中或回测结果理解为保证盈利。</p>",
  "excerpt": "分分彩投注技巧不能只看命中率，还要同时核算单期成本、返奖、连续不中和最大资金暴露。本文从经济结构与风险控制角度说明如何评价一套方案。",
  "seo_title": "分分彩投注技巧：命中率、奖金、倍投与资金风险怎么一起看",
  "meta_description": "分析分分彩投注技巧时，不能只看历史命中率。本文从投注成本、中奖返奖、连续不中、倍投资金路径和历史验证五个角度说明如何判断方案是否可执行。",
  "primary_keyword": "分分彩投注技巧",
  "secondary_keywords": [
    "分分彩投注方法",
    "分分彩技巧",
    "分分彩技术",
    "分分彩倍投",
    "彩票资金管理"
  ],
  "catid": 7,
  "thumbnail": "",
  "internal_links": [],
  "publish_at": "2026-08-11T09:00:00+08:00",
  "author": "老彩迷编辑",
  "content_type": "guide",
  "source_notes": "用于自动发布系统首次生产烟雾测试，同时作为真实SEO基础文章。内容不承诺盈利。",
  "commercial_disclosure": false
}
