{
  "schema_version": 1,
  "article_key": "native-cms-lifecycle-v2",
  "title": "分分彩挂机方案验证：连续不中时先看资金暴露和停止条件",
  "slug": "ffc-auto-plan-drawdown-stop-rules",
  "content": "<p>验证分分彩挂机方案时，连续不中不是可以忽略的异常，而是资金设计必须提前覆盖的正常风险场景。一个方案如果只展示命中阶段，却没有写清连续不中时会投入多少、何时降级、何时停止，那么它还不能算完整的可执行方案。</p><h2>一、把连续不中转换成具体资金暴露</h2><p>先从单期真实成本开始，把每一期的投注金额按资金路径逐期累加。这样可以直接看到连续3期、5期、10期甚至更长时间不中时，本金实际需要承担多少损失。相比只写一个最高倍数，这种累计资金暴露更接近真实执行。</p><h2>二、停止条件要在开始前确定</h2><p>停止条件可以包括最大累计投入、最大允许回撤、连续不中上限以及异常数据时暂停。关键不是选择哪一个固定数字，而是这些边界必须与总本金匹配，并且在方案启动前确定。出现亏损后再临时扩大上限，会让原本的风险控制失去作用。</p><h2>三、倍投改变的是资金路径，不是开奖概率</h2><p>提高某一期的投注倍数不会让下一期开奖结果更容易命中。倍投设计真正改变的是命中发生在不同档位时的收益和亏损结构。因此，在评价高级倍投时，应同时检查每档成本、此前累计亏损、命中返奖以及全链不中时的最大损失。</p><h2>四、历史验证要保留失败区间</h2><p>历史数据可以用于检查最长连续不中、最大回撤和规则稳定性，但不应只选择表现最好的区间。更可靠的做法是保留滚动验证、样本外区间和失败样本，并明确历史结果不能保证未来重复。</p><p>本站将挂机方案作为数据研究与执行验证内容记录。任何方案都存在不确定性，自动执行的目的应当是减少人工操作误差，而不是把历史命中率包装成未来收益保证。</p>",
  "excerpt": "分分彩挂机方案验证不能只看命中阶段，还要计算连续不中时的累计资金暴露、最大回撤和明确停止条件。",
  "seo_title": "分分彩挂机方案验证：连续不中、资金暴露与停止条件怎么检查",
  "meta_description": "从连续不中、累计资金暴露、倍投路径、最大回撤和停止条件五个角度说明如何验证分分彩挂机方案，避免只看历史命中率。",
  "primary_keyword": "分分彩挂机方案验证",
  "secondary_keywords": [
    "分分彩挂机方案",
    "分分彩倍投",
    "彩票资金管理",
    "分分彩数据分析",
    "挂机方案风险"
  ],
  "catid": 2,
  "thumbnail": "",
  "internal_links": [],
  "publish_at": "2026-08-11T10:00:00+08:00",
  "author": "老彩迷编辑",
  "content_type": "guide",
  "source_notes": "用于验证Xunrui原生发布适配器的第二次独立生产烟雾测试，内容不承诺盈利。",
  "commercial_disclosure": false
}
