{
  "schema_version": 1,
  "article_key": "seo-ffc-rebate-accounting-v1",
  "title": "分分彩返点怎么计算：不要把返点和中奖返奖混在一起",
  "slug": "ffc-rebate-accounting",
  "content": "<p>在分分彩资金核算里，返点经常和中奖返奖混在一起写，结果造成同一笔金额被重复计算。更清晰的做法，是把投注成本、中奖返奖和返点拆成三个独立项目，再计算当期和累计净结果。</p><h2>一、返点通常与有效投注额相关</h2><p>如果某个平台的返点按有效投注金额的一定比例计算，那么基础公式应从实际投注金额出发。实际投注金额又取决于真实注数、单注金额和当期倍数，因此不能用候选数字数量代替。具体比例必须以实际可验证的账户规则为准。</p><h2>二、中奖返奖与返点是两条不同现金流</h2><p>中奖返奖来自某一玩法命中后的奖金结构，返点则通常来自投注金额。核算时可以分别设置“中奖总返奖”和“返点”两列，再统一减去投注成本。如果一开始就把返点加入奖金，后面又单独加一次，就会高估资金结果。</p><h2>三、依赖返点的方案要做敏感性检查</h2><p>有些方案在不计返点时接近持平，加入返点后才出现正差额。遇到这种结构，应额外测试返点降低、取消或结算方式变化时会发生什么。若方案只在某一个固定返点参数下成立，就应在说明中明确这一依赖，而不是把它当成选号能力。</p><h2>四、连续不中时返点不能掩盖资金暴露</h2><p>返点可能降低一部分实际成本，但通常不能消除连续不中带来的累计投入。倍投后段金额增加时，仍要单独计算最大资金暴露、最大回撤和停止条件。把返点视为风险缓冲可以，但不能把它当成无限延长资金链的理由。</p><h2>五、验证记录要保存返点规则版本</h2><p>如果平台规则发生变化，历史回测使用的返点参数可能已经不适用于当前环境。方案文件应记录返点比例、适用时间和数据来源，并在规则变化后重新计算，而不是沿用旧参数。</p><p>返点只是经济结构中的一项变量。只有把它与真实投注成本、中奖返奖、连续不中和本金上限分开记录，才能得到可复算的资金结果。任何历史核算都不能保证未来收益。</p>",
  "excerpt": "分分彩返点应与中奖返奖分开核算，并基于真实投注金额计算；依赖返点的方案还需要检查规则变化后的结果。",
  "seo_title": "分分彩返点怎么计算？别和中奖返奖重复计入",
  "meta_description": "解释分分彩返点的核算方式，区分投注成本、中奖返奖和返点三类现金流，并说明返点敏感性、连续不中和规则版本检查。",
  "primary_keyword": "分分彩返点",
  "secondary_keywords": ["分分彩返奖", "分分彩投注金额", "分分彩资金管理", "分分彩成本", "分分彩方案验证"],
  "catid": 7,
  "thumbnail": "",
  "internal_links": [],
  "publish_at": "2026-08-14T17:00:00+08:00",
  "author": "老彩迷编辑",
  "content_type": "guide",
  "source_notes": "SEO Batch 1；返点核算方法，不对具体平台返点作无证据承诺。",
  "commercial_disclosure": false
}
