{
  "schema_version": 1,
  "article_key": "example-ffc-data-validation",
  "title": "分分彩方案验证应该看什么：从命中率到资金暴露的完整检查框架",
  "slug": "ffc-scheme-validation-framework",
  "content": "<p>一个方案是否值得继续研究，不能只看短期命中了多少次。更有意义的验证至少需要同时记录样本期数、真实投注成本、返奖、连续不中长度、最大资金暴露，以及规则是否在看到未来数据之前就已经确定。</p><h2>先固定规则，再看结果</h2><p>如果每次看到开奖结果以后再调整选号条件，历史结果很容易被后验拟合。更合理的做法是先固定候选号码生成规则、投注位置、停止条件与资金管理，再用后续数据验证。</p><h2>命中率不是盈利率</h2><p>高命中率并不自动等于正收益。需要把单期成本、中奖返奖、未中损失、返点和倍投后的累计风险放进同一张表计算。对于连续不中，也应披露最长历史序列以及本金能够承受的极端路径。</p><h2>保留失败结果</h2><p>真正有价值的实验不应只展示成功样本。失败的参数、失效区间和资金压力同样应该记录，这些信息有助于判断方案是否只是偶然适配某一小段历史数据。</p>",
  "excerpt": "用统一框架检查分分彩方案的命中率、真实成本、连续不中、资金暴露和后验拟合风险。",
  "seo_title": "分分彩方案验证：命中率、成本与资金暴露怎么一起看",
  "meta_description": "分分彩方案验证不能只看命中率。本文用统一框架说明如何检查投注成本、返奖、连续不中、最大资金暴露以及后验拟合风险。",
  "primary_keyword": "分分彩方案验证",
  "secondary_keywords": ["分分彩数据分析", "历史数据回测", "彩票方案验证", "资金管理"],
  "catid": 7,
  "thumbnail": "",
  "internal_links": [],
  "publish_at": "2026-12-31T09:00:00+08:00",
  "author": "彩研导航站",
  "content_type": "guide",
  "source_notes": "示例文件，仅用于说明Article Queue格式；正式文章需经过关键词映射和内容审校。",
  "commercial_disclosure": false
}
