{
  "schema_version": 1,
  "article_key": "native-cms-lifecycle-v1",
  "title": "分分彩挂机方案上线前：命中、成本、止损与执行检查",
  "slug": "ffc-auto-plan-preflight-check",
  "content": "<p>一套分分彩挂机方案在进入真实自动执行之前，不能只看最近几期的命中结果。更重要的是确认方案本身是否具备清晰的成本结构、停止条件和执行边界。只有这些条件都可以被复核，自动化才是在减少人工操作，而不是把风险放大。</p><h2>一、先确认命中率对应的是哪一种规则</h2><p>历史命中率必须和明确的选号规则、位置、注数以及统计窗口绑定。若规则在回看数据时不断调整，那么得到的命中率很容易失去验证意义。上线前应固定规则，并保留样本外数据继续观察。</p><h2>二、把单期成本和返奖单独核算</h2><p>相同命中率在不同玩法下可能对应完全不同的资金结果。需要先计算单期真实投注成本、命中后的总返奖、未中损失和返点，再判断资金路径能否承受连续不中。不要把命中率直接等同于盈利率。</p><h2>三、自动执行必须预先设置停止条件</h2><p>停止条件至少应包含最大资金暴露、最大连续不中、单日允许亏损以及异常数据时的暂停规则。倍投只改变投入金额，不会改变下一期开奖结果，因此资金上限应该在方案启动之前确定，而不是亏损扩大以后再临时决定。</p><h2>四、上线前做一次完整执行检查</h2><p>最后检查投注数字是否可复算、每期注数是否正确、最低投注单位是否符合平台限制、软件触发条件是否与方案说明一致，并用小规模测试验证实际执行结果。历史数据适合发现问题和验证规则，但不能保证未来结果。</p><p>本站将这类方案作为数据研究和执行验证内容记录，保留失败样本、连续不中和资金暴露等信息，不把历史表现描述为未来收益承诺。</p>",
  "excerpt": "分分彩挂机方案上线前，需要同时核对选号规则、单期成本、返奖、停止条件和自动执行逻辑，避免只看历史命中率。",
  "seo_title": "分分彩挂机方案上线前检查：命中率、成本、止损与自动执行",
  "meta_description": "介绍分分彩挂机方案在自动执行前应核对的四项内容：选号规则与命中率、单期成本与返奖、资金止损边界以及软件执行条件。",
  "primary_keyword": "分分彩挂机方案",
  "secondary_keywords": [
    "分分彩方案",
    "分分彩技巧",
    "彩票挂机方案",
    "分分彩倍投",
    "彩票资金管理"
  ],
  "catid": 2,
  "thumbnail": "",
  "internal_links": [],
  "publish_at": "2026-08-11T09:30:00+08:00",
  "author": "老彩迷编辑",
  "content_type": "guide",
  "source_notes": "用于验证迅睿CMS原生save_content发布生命周期。内容不承诺盈利。",
  "commercial_disclosure": false
}
